
*** Running vivado
    with args -log CSSTE.vds -m64 -product Vivado -mode batch -messageDb vivado.pb -notrace -source CSSTE.tcl



****** Vivado v2024.2 (64-bit)
  **** SW Build 5239630 on Fri Nov 08 22:35:27 MST 2024
  **** IP Build 5239520 on Sun Nov 10 16:12:51 MST 2024
  **** SharedData Build 5239561 on Fri Nov 08 14:39:27 MST 2024
  **** Start of session at: Fri Dec 12 10:37:42 2025
    ** Copyright 1986-2022 Xilinx, Inc. All Rights Reserved.
    ** Copyright 2022-2024 Advanced Micro Devices, Inc. All Rights Reserved.

source CSSTE.tcl -notrace
INFO: [IP_Flow 19-234] Refreshing IP repositories
INFO: [IP_Flow 19-1700] Loaded user IP repository 'd:/XilinxData/ComputerOrganization/Experiment_05/Other_Referrence_IP/IP/Seg7_Dev'.
INFO: [IP_Flow 19-2313] Loaded Vivado IP repository 'D:/Xilinx/Vivado/2024.2/data/ip'.
WARNING: [IP_Flow 19-4995] The host OS only allows 260 characters in a normal path. The IP cache path is more than 80 characters. If you experience issues with IP caching, please consider changing the IP cache to a location with a shorter path. Alternately consider using the OS subst command to map part of the path to a drive letter. 
Current IP cache path is d:/XilinxData/ComputerOrganization/Experiment_05/Experiment05_Pipelined_CPU_MyIFID/Experiment05_Pipelined_CPU_MyIFID.cache/ip 
Command: read_checkpoint -auto_incremental -incremental D:/XilinxData/ComputerOrganization/Experiment_05/Experiment05_Pipelined_CPU_MyIFID/Experiment05_Pipelined_CPU_MyIFID.srcs/utils_1/imports/synth_1/CSSTE.dcp
INFO: [Vivado 12-5825] Read reference checkpoint from D:/XilinxData/ComputerOrganization/Experiment_05/Experiment05_Pipelined_CPU_MyIFID/Experiment05_Pipelined_CPU_MyIFID.srcs/utils_1/imports/synth_1/CSSTE.dcp for incremental synthesis
INFO: [Vivado 12-7989] Please ensure there are no constraint changes
Command: synth_design -top CSSTE -part xc7a100tcsg324-1
Starting synth_design
Attempting to get a license for feature 'Synthesis' and/or device 'xc7a100t'
INFO: [Common 17-349] Got license for feature 'Synthesis' and/or device 'xc7a100t'
INFO: [Device 21-403] Loading part xc7a100tcsg324-1
INFO: [Designutils 20-5440] No compile time benefit to using incremental synthesis; A full resynthesis will be run
INFO: [Designutils 20-4379] Flow is switching to default flow due to incremental criteria not met. If you would like to alter this behaviour and have the flow terminate instead, please set the following parameter config_implementation {autoIncr.Synth.RejectBehavior Terminate}
INFO: [Synth 8-7079] Multithreading enabled for synth_design using a maximum of 2 processes.
INFO: [Synth 8-7078] Launching helper process for spawning children vivado processes
INFO: [Synth 8-7075] Helper process launched with PID 15804
---------------------------------------------------------------------------------
Starting RTL Elaboration : Time (s): cpu = 00:00:02 ; elapsed = 00:00:03 . Memory (MB): peak = 1054.770 ; gain = 468.836
---------------------------------------------------------------------------------
INFO: [Synth 8-11241] undeclared symbol 'SCPU_ctrl_more_0_ImmSel', assumed default net type 'wire' [D:/XilinxData/ComputerOrganization/Experiment_05/Experiment05_Pipelined_CPU_MyIFID/Experiment05_Pipelined_CPU_MyIFID.srcs/sources_1/new/Pipeline_ID.v:127]
INFO: [Synth 8-11241] undeclared symbol 'U7_led_sout', assumed default net type 'wire' [D:/XilinxData/ComputerOrganization/Experiment_05/CSSTE.v:388]
INFO: [Synth 8-6157] synthesizing module 'CSSTE' [D:/XilinxData/ComputerOrganization/Experiment_05/CSSTE.v:45]
INFO: [Synth 8-6157] synthesizing module 'SAnti_jitter' [D:/XilinxData/ComputerOrganization/Experiment_05/Other_Referrence_IP/IP/SAnti_jitter.v:15]
INFO: [Synth 8-6157] synthesizing module 'clk_div' [D:/XilinxData/ComputerOrganization/Experiment_05/Other_Referrence_IP/IP/clk_div.v:15]
INFO: [Synth 8-6157] synthesizing module 'ROM_D_0' [D:/XilinxData/ComputerOrganization/Experiment_05/Experiment05_Pipelined_CPU_MyIFID/Experiment05_Pipelined_CPU_MyIFID.runs/synth_1/.Xil/Vivado-30816-LAPTOP-6I7OJEUU/realtime/ROM_D_0_stub.v:6]
INFO: [Synth 8-6155] done synthesizing module 'ROM_D_0' (0#1) [D:/XilinxData/ComputerOrganization/Experiment_05/Experiment05_Pipelined_CPU_MyIFID/Experiment05_Pipelined_CPU_MyIFID.runs/synth_1/.Xil/Vivado-30816-LAPTOP-6I7OJEUU/realtime/ROM_D_0_stub.v:6]
INFO: [Synth 8-6157] synthesizing module 'Pipelined_CPU' [D:/XilinxData/ComputerOrganization/Experiment_05/Pipelined_CPU/Pipelined_CPU.v:23]
INFO: [Synth 8-6157] synthesizing module 'Pipeline_IF' [D:/XilinxData/ComputerOrganization/Experiment_05/Experiment05_Pipelined_CPU_MyIFID/Experiment05_Pipelined_CPU_MyIFID.srcs/sources_1/new/Pipeline_IF.v:23]
INFO: [Synth 8-6157] synthesizing module 'MUX2T1_32' [D:/XilinxData/ComputerOrganization/Experiment_05/Pipeline_IFID/MUX2T1_32.v:1]
INFO: [Synth 8-6155] done synthesizing module 'MUX2T1_32' (0#1) [D:/XilinxData/ComputerOrganization/Experiment_05/Pipeline_IFID/MUX2T1_32.v:1]
INFO: [Synth 8-6157] synthesizing module 'PC' [D:/XilinxData/ComputerOrganization/Experiment_05/Pipeline_IFID/REG_32.v:23]
INFO: [Synth 8-6155] done synthesizing module 'PC' (0#1) [D:/XilinxData/ComputerOrganization/Experiment_05/Pipeline_IFID/REG_32.v:23]
INFO: [Synth 8-6157] synthesizing module 'Add_32' [D:/XilinxData/ComputerOrganization/Experiment_05/Pipeline_IFID/Add_32.v:1]
INFO: [Synth 8-6155] done synthesizing module 'Add_32' (0#1) [D:/XilinxData/ComputerOrganization/Experiment_05/Pipeline_IFID/Add_32.v:1]
INFO: [Synth 8-6155] done synthesizing module 'Pipeline_IF' (0#1) [D:/XilinxData/ComputerOrganization/Experiment_05/Experiment05_Pipelined_CPU_MyIFID/Experiment05_Pipelined_CPU_MyIFID.srcs/sources_1/new/Pipeline_IF.v:23]
INFO: [Synth 8-6157] synthesizing module 'IF_reg_ID' [D:/XilinxData/ComputerOrganization/Experiment_05/Experiment05_Pipelined_CPU_MyIFID/Experiment05_Pipelined_CPU_MyIFID.srcs/sources_1/new/IF_reg_ID.v:23]
INFO: [Synth 8-6155] done synthesizing module 'IF_reg_ID' (0#1) [D:/XilinxData/ComputerOrganization/Experiment_05/Experiment05_Pipelined_CPU_MyIFID/Experiment05_Pipelined_CPU_MyIFID.srcs/sources_1/new/IF_reg_ID.v:23]
INFO: [Synth 8-6157] synthesizing module 'Pipeline_ID' [D:/XilinxData/ComputerOrganization/Experiment_05/Experiment05_Pipelined_CPU_MyIFID/Experiment05_Pipelined_CPU_MyIFID.srcs/sources_1/new/Pipeline_ID.v:23]
INFO: [Synth 8-6157] synthesizing module 'Register_32M32b' [D:/XilinxData/ComputerOrganization/Experiment_05/Pipeline_IFID/Register_32M32b.v:23]
INFO: [Synth 8-6155] done synthesizing module 'Register_32M32b' (0#1) [D:/XilinxData/ComputerOrganization/Experiment_05/Pipeline_IFID/Register_32M32b.v:23]
INFO: [Synth 8-6157] synthesizing module 'ImmGen_new' [D:/XilinxData/ComputerOrganization/Experiment_05/Pipeline_IFID/ImmGen_new.v:23]
INFO: [Synth 8-155] case statement is not full and has no default [D:/XilinxData/ComputerOrganization/Experiment_05/Pipeline_IFID/ImmGen_new.v:30]
INFO: [Synth 8-6155] done synthesizing module 'ImmGen_new' (0#1) [D:/XilinxData/ComputerOrganization/Experiment_05/Pipeline_IFID/ImmGen_new.v:23]
WARNING: [Synth 8-689] width (1) of port connection 'ImmSel' does not match port width (3) of module 'ImmGen_new' [D:/XilinxData/ComputerOrganization/Experiment_05/Experiment05_Pipelined_CPU_MyIFID/Experiment05_Pipelined_CPU_MyIFID.srcs/sources_1/new/Pipeline_ID.v:127]
INFO: [Synth 8-6157] synthesizing module 'SCPU_ctrl_more' [D:/XilinxData/ComputerOrganization/Experiment_05/Pipeline_IFID/SCPU_ctrl_more.v:21]
INFO: [Synth 8-226] default block is never used [D:/XilinxData/ComputerOrganization/Experiment_05/Pipeline_IFID/SCPU_ctrl_more.v:89]
INFO: [Synth 8-6155] done synthesizing module 'SCPU_ctrl_more' (0#1) [D:/XilinxData/ComputerOrganization/Experiment_05/Pipeline_IFID/SCPU_ctrl_more.v:21]
WARNING: [Synth 8-689] width (1) of port connection 'ImmSel' does not match port width (3) of module 'SCPU_ctrl_more' [D:/XilinxData/ComputerOrganization/Experiment_05/Experiment05_Pipelined_CPU_MyIFID/Experiment05_Pipelined_CPU_MyIFID.srcs/sources_1/new/Pipeline_ID.v:137]
INFO: [Synth 8-6155] done synthesizing module 'Pipeline_ID' (0#1) [D:/XilinxData/ComputerOrganization/Experiment_05/Experiment05_Pipelined_CPU_MyIFID/Experiment05_Pipelined_CPU_MyIFID.srcs/sources_1/new/Pipeline_ID.v:23]
WARNING: [Synth 8-689] width (32) of port connection 'Rd_addr_out_ID' does not match port width (5) of module 'Pipeline_ID' [D:/XilinxData/ComputerOrganization/Experiment_05/Pipelined_CPU/Pipelined_CPU.v:157]
WARNING: [Synth 8-689] width (4) of port connection 'ALU_control_ID' does not match port width (3) of module 'Pipeline_ID' [D:/XilinxData/ComputerOrganization/Experiment_05/Pipelined_CPU/Pipelined_CPU.v:162]
INFO: [Synth 8-6157] synthesizing module 'ID_reg_EX' [D:/XilinxData/ComputerOrganization/Experiment_05/Experiment05_Pipelined_CPU_MyIFID/Experiment05_Pipelined_CPU_MyIFID.srcs/sources_1/new/ID_reg_EX.v:23]
INFO: [Synth 8-6155] done synthesizing module 'ID_reg_EX' (0#1) [D:/XilinxData/ComputerOrganization/Experiment_05/Experiment05_Pipelined_CPU_MyIFID/Experiment05_Pipelined_CPU_MyIFID.srcs/sources_1/new/ID_reg_EX.v:23]
WARNING: [Synth 8-689] width (32) of port connection 'Rd_addr_IDEX' does not match port width (5) of module 'ID_reg_EX' [D:/XilinxData/ComputerOrganization/Experiment_05/Pipelined_CPU/Pipelined_CPU.v:209]
WARNING: [Synth 8-689] width (4) of port connection 'ALU_control_in_IDEX' does not match port width (3) of module 'ID_reg_EX' [D:/XilinxData/ComputerOrganization/Experiment_05/Pipelined_CPU/Pipelined_CPU.v:214]
INFO: [Synth 8-6157] synthesizing module 'Pipeline_Ex' [D:/XilinxData/ComputerOrganization/Experiment_05/Pipelined_CPU/Pipeline_Ex.v:15]
INFO: [Synth 8-6157] synthesizing module 'Ex_reg_Mem' [D:/XilinxData/ComputerOrganization/Experiment_05/Pipelined_CPU/Ex_reg_Mem.v:15]
INFO: [Synth 8-6157] synthesizing module 'Pipeline_Mem' [D:/XilinxData/ComputerOrganization/Experiment_05/Pipelined_CPU/Pipeline_Mem.v:15]
INFO: [Synth 8-6157] synthesizing module 'Mem_reg_WB' [D:/XilinxData/ComputerOrganization/Experiment_05/Pipelined_CPU/Mem_reg_WB.v:15]
INFO: [Synth 8-6157] synthesizing module 'Pipeline_WB' [D:/XilinxData/ComputerOrganization/Experiment_05/Pipelined_CPU/Pipeline_WB.v:15]
INFO: [Synth 8-6155] done synthesizing module 'Pipelined_CPU' (0#1) [D:/XilinxData/ComputerOrganization/Experiment_05/Pipelined_CPU/Pipelined_CPU.v:23]
INFO: [Synth 8-6157] synthesizing module 'RAM' [D:/XilinxData/ComputerOrganization/Experiment_05/Experiment05_Pipelined_CPU_MyIFID/Experiment05_Pipelined_CPU_MyIFID.runs/synth_1/.Xil/Vivado-30816-LAPTOP-6I7OJEUU/realtime/RAM_stub.v:6]
INFO: [Synth 8-6155] done synthesizing module 'RAM' (0#1) [D:/XilinxData/ComputerOrganization/Experiment_05/Experiment05_Pipelined_CPU_MyIFID/Experiment05_Pipelined_CPU_MyIFID.runs/synth_1/.Xil/Vivado-30816-LAPTOP-6I7OJEUU/realtime/RAM_stub.v:6]
INFO: [Synth 8-6157] synthesizing module 'Counter_x' [D:/XilinxData/ComputerOrganization/Experiment_05/Other_Referrence_IP/IP/Counter_x.v:15]
INFO: [Synth 8-6157] synthesizing module 'MIO_BUS' [D:/XilinxData/ComputerOrganization/Experiment_05/Other_Referrence_IP/IP/MIO_BUS.v:15]
INFO: [Synth 8-6157] synthesizing module 'Multi_8CH32' [D:/XilinxData/ComputerOrganization/Experiment_05/Other_Referrence_IP/IP/Multi_8CH32.v:15]
INFO: [Synth 8-6157] synthesizing module 'VGA' [D:/XilinxData/ComputerOrganization/Experiment_05/Other_Referrence_IP/VGA/VGA.v:23]
INFO: [Synth 8-6157] synthesizing module 'VgaController' [D:/XilinxData/ComputerOrganization/Experiment_05/Other_Referrence_IP/VGA/VgaController.v:1]
INFO: [Synth 8-6155] done synthesizing module 'VgaController' (0#1) [D:/XilinxData/ComputerOrganization/Experiment_05/Other_Referrence_IP/VGA/VgaController.v:1]
INFO: [Synth 8-6157] synthesizing module 'VgaDisplay' [D:/XilinxData/ComputerOrganization/Experiment_05/Other_Referrence_IP/VGA/VgaDisplay.v:1]
INFO: [Synth 8-3876] $readmem data file 'D:/XilinxData/ComputerOrganization/Experiment_05/vga_debugger.mem' is read successfully [D:/XilinxData/ComputerOrganization/Experiment_05/Other_Referrence_IP/VGA/VgaDisplay.v:15]
INFO: [Synth 8-3876] $readmem data file 'D:/XilinxData/ComputerOrganization/Experiment_05/font_8x16.mem' is read successfully [D:/XilinxData/ComputerOrganization/Experiment_05/Other_Referrence_IP/VGA/VgaDisplay.v:25]
INFO: [Synth 8-6155] done synthesizing module 'VgaDisplay' (0#1) [D:/XilinxData/ComputerOrganization/Experiment_05/Other_Referrence_IP/VGA/VgaDisplay.v:1]
INFO: [Synth 8-6157] synthesizing module 'VgaDebugger' [D:/XilinxData/ComputerOrganization/Experiment_05/Other_Referrence_IP/VGA/VgaDebugger.v:5]
INFO: [Synth 8-6157] synthesizing module 'Hex2Ascii' [D:/XilinxData/ComputerOrganization/Experiment_05/Other_Referrence_IP/VGA/Hex2Ascii.v:23]
INFO: [Synth 8-6155] done synthesizing module 'Hex2Ascii' (0#1) [D:/XilinxData/ComputerOrganization/Experiment_05/Other_Referrence_IP/VGA/Hex2Ascii.v:23]
INFO: [Synth 8-6155] done synthesizing module 'VgaDebugger' (0#1) [D:/XilinxData/ComputerOrganization/Experiment_05/Other_Referrence_IP/VGA/VgaDebugger.v:5]
INFO: [Synth 8-6155] done synthesizing module 'VGA' (0#1) [D:/XilinxData/ComputerOrganization/Experiment_05/Other_Referrence_IP/VGA/VGA.v:23]
INFO: [Synth 8-6157] synthesizing module 'SPIO' [D:/XilinxData/ComputerOrganization/Experiment_05/Other_Referrence_IP/IP/SPIO.v:15]
INFO: [Synth 8-6157] synthesizing module 'Seg7_Dev_0' [D:/XilinxData/ComputerOrganization/Experiment_05/Experiment05_Pipelined_CPU_MyIFID/Experiment05_Pipelined_CPU_MyIFID.runs/synth_1/.Xil/Vivado-30816-LAPTOP-6I7OJEUU/realtime/Seg7_Dev_0_stub.v:6]
INFO: [Synth 8-6155] done synthesizing module 'Seg7_Dev_0' (0#1) [D:/XilinxData/ComputerOrganization/Experiment_05/Experiment05_Pipelined_CPU_MyIFID/Experiment05_Pipelined_CPU_MyIFID.runs/synth_1/.Xil/Vivado-30816-LAPTOP-6I7OJEUU/realtime/Seg7_Dev_0_stub.v:6]
INFO: [Synth 8-6155] done synthesizing module 'CSSTE' (0#1) [D:/XilinxData/ComputerOrganization/Experiment_05/CSSTE.v:45]
WARNING: [Synth 8-3848] Net ExRegMem_PC_out_ExMem in module/entity Pipelined_CPU does not have driver. [D:/XilinxData/ComputerOrganization/Experiment_05/Pipelined_CPU/Pipelined_CPU.v:71]
WARNING: [Synth 8-7129] Port inst_field[6] in module ImmGen_new is either unconnected or has no load
WARNING: [Synth 8-7129] Port inst_field[5] in module ImmGen_new is either unconnected or has no load
WARNING: [Synth 8-7129] Port inst_field[4] in module ImmGen_new is either unconnected or has no load
WARNING: [Synth 8-7129] Port inst_field[3] in module ImmGen_new is either unconnected or has no load
WARNING: [Synth 8-7129] Port inst_field[2] in module ImmGen_new is either unconnected or has no load
WARNING: [Synth 8-7129] Port inst_field[1] in module ImmGen_new is either unconnected or has no load
WARNING: [Synth 8-7129] Port inst_field[0] in module ImmGen_new is either unconnected or has no load
---------------------------------------------------------------------------------
Finished RTL Elaboration : Time (s): cpu = 00:00:02 ; elapsed = 00:00:04 . Memory (MB): peak = 1180.367 ; gain = 594.434
---------------------------------------------------------------------------------
---------------------------------------------------------------------------------
Start Handling Custom Attributes
---------------------------------------------------------------------------------
---------------------------------------------------------------------------------
Finished Handling Custom Attributes : Time (s): cpu = 00:00:02 ; elapsed = 00:00:04 . Memory (MB): peak = 1180.367 ; gain = 594.434
---------------------------------------------------------------------------------
---------------------------------------------------------------------------------
Finished RTL Optimization Phase 1 : Time (s): cpu = 00:00:02 ; elapsed = 00:00:04 . Memory (MB): peak = 1180.367 ; gain = 594.434
---------------------------------------------------------------------------------
Netlist sorting complete. Time (s): cpu = 00:00:00 ; elapsed = 00:00:00.032 . Memory (MB): peak = 1180.367 ; gain = 0.000
INFO: [Project 1-570] Preparing netlist for logic optimization

Processing XDC Constraints
Initializing timing engine
Parsing XDC File [d:/XilinxData/ComputerOrganization/Experiment_05/Experiment05_Pipelined_CPU_MyIFID/Experiment05_Pipelined_CPU_MyIFID.gen/sources_1/ip/ROM_D_0/ROM_D_0/ROM_D_0_in_context.xdc] for cell 'U2'
Finished Parsing XDC File [d:/XilinxData/ComputerOrganization/Experiment_05/Experiment05_Pipelined_CPU_MyIFID/Experiment05_Pipelined_CPU_MyIFID.gen/sources_1/ip/ROM_D_0/ROM_D_0/ROM_D_0_in_context.xdc] for cell 'U2'
Parsing XDC File [d:/XilinxData/ComputerOrganization/Experiment_05/Experiment05_Pipelined_CPU_MyIFID/Experiment05_Pipelined_CPU_MyIFID.gen/sources_1/ip/RAM/RAM/RAM_in_context.xdc] for cell 'U3'
Finished Parsing XDC File [d:/XilinxData/ComputerOrganization/Experiment_05/Experiment05_Pipelined_CPU_MyIFID/Experiment05_Pipelined_CPU_MyIFID.gen/sources_1/ip/RAM/RAM/RAM_in_context.xdc] for cell 'U3'
Parsing XDC File [d:/XilinxData/ComputerOrganization/Experiment_05/Experiment05_Pipelined_CPU_MyIFID/Experiment05_Pipelined_CPU_MyIFID.gen/sources_1/ip/Seg7_Dev_0/Seg7_Dev_0/Seg7_Dev_1_in_context.xdc] for cell 'U6'
Finished Parsing XDC File [d:/XilinxData/ComputerOrganization/Experiment_05/Experiment05_Pipelined_CPU_MyIFID/Experiment05_Pipelined_CPU_MyIFID.gen/sources_1/ip/Seg7_Dev_0/Seg7_Dev_0/Seg7_Dev_1_in_context.xdc] for cell 'U6'
Parsing XDC File [D:/XilinxData/ComputerOrganization/Experiment_05/Other_Referrence_IP/A7.xdc]
Finished Parsing XDC File [D:/XilinxData/ComputerOrganization/Experiment_05/Other_Referrence_IP/A7.xdc]
INFO: [Project 1-236] Implementation specific constraints were found while reading constraint file [D:/XilinxData/ComputerOrganization/Experiment_05/Other_Referrence_IP/A7.xdc]. These constraints will be ignored for synthesis but will be used in implementation. Impacted constraints are listed in the file [.Xil/CSSTE_propImpl.xdc].
Resolution: To avoid this warning, move constraints listed in [.Xil/CSSTE_propImpl.xdc] to another XDC file and exclude this new file from synthesis with the used_in_synthesis property (File Properties dialog in GUI) and re-run elaboration/synthesis.
Completed Processing XDC Constraints

Netlist sorting complete. Time (s): cpu = 00:00:00 ; elapsed = 00:00:00.001 . Memory (MB): peak = 1263.543 ; gain = 0.000
INFO: [Project 1-111] Unisim Transformation Summary:
No Unisim elements were transformed.

Constraint Validation Runtime : Time (s): cpu = 00:00:00 ; elapsed = 00:00:00.004 . Memory (MB): peak = 1263.543 ; gain = 0.000
INFO: [Designutils 20-5440] No compile time benefit to using incremental synthesis; A full resynthesis will be run
INFO: [Designutils 20-4379] Flow is switching to default flow due to incremental criteria not met. If you would like to alter this behaviour and have the flow terminate instead, please set the following parameter config_implementation {autoIncr.Synth.RejectBehavior Terminate}
---------------------------------------------------------------------------------
Finished Constraint Validation : Time (s): cpu = 00:00:06 ; elapsed = 00:00:09 . Memory (MB): peak = 1263.543 ; gain = 677.609
---------------------------------------------------------------------------------
---------------------------------------------------------------------------------
Start Loading Part and Timing Information
---------------------------------------------------------------------------------
Loading part: xc7a100tcsg324-1
---------------------------------------------------------------------------------
Finished Loading Part and Timing Information : Time (s): cpu = 00:00:06 ; elapsed = 00:00:09 . Memory (MB): peak = 1263.543 ; gain = 677.609
---------------------------------------------------------------------------------
---------------------------------------------------------------------------------
Start Applying 'set_property' XDC Constraints
---------------------------------------------------------------------------------
Applied set_property KEEP_HIERARCHY = SOFT for U2. (constraint file  auto generated constraint).
Applied set_property KEEP_HIERARCHY = SOFT for U3. (constraint file  auto generated constraint).
Applied set_property KEEP_HIERARCHY = SOFT for U6. (constraint file  auto generated constraint).
---------------------------------------------------------------------------------
Finished applying 'set_property' XDC Constraints : Time (s): cpu = 00:00:06 ; elapsed = 00:00:09 . Memory (MB): peak = 1263.543 ; gain = 677.609
---------------------------------------------------------------------------------
WARNING: [Synth 8-327] inferring latch for variable 'Imm_out_reg' [D:/XilinxData/ComputerOrganization/Experiment_05/Pipeline_IFID/ImmGen_new.v:31]
WARNING: [Synth 8-327] inferring latch for variable 'Branch_reg' [D:/XilinxData/ComputerOrganization/Experiment_05/Pipeline_IFID/SCPU_ctrl_more.v:53]
WARNING: [Synth 8-327] inferring latch for variable 'BranchN_reg' [D:/XilinxData/ComputerOrganization/Experiment_05/Pipeline_IFID/SCPU_ctrl_more.v:53]
---------------------------------------------------------------------------------
Finished RTL Optimization Phase 2 : Time (s): cpu = 00:00:08 ; elapsed = 00:00:11 . Memory (MB): peak = 1263.543 ; gain = 677.609
---------------------------------------------------------------------------------
---------------------------------------------------------------------------------
Start RTL Component Statistics 
---------------------------------------------------------------------------------
Detailed RTL Component Info : 
+---Adders : 
	   2 Input   32 Bit       Adders := 1     
	   2 Input   12 Bit       Adders := 1     
	   2 Input   10 Bit       Adders := 3     
	   2 Input    9 Bit       Adders := 1     
	   3 Input    8 Bit       Adders := 1     
+---Registers : 
	               32 Bit    Registers := 38    
	               12 Bit    Registers := 1     
	               10 Bit    Registers := 2     
	                5 Bit    Registers := 1     
	                3 Bit    Registers := 1     
	                2 Bit    Registers := 1     
	                1 Bit    Registers := 8     
+---Muxes : 
	   2 Input   32 Bit        Muxes := 7     
	   2 Input   10 Bit        Muxes := 1     
	   2 Input    9 Bit        Muxes := 1     
	   2 Input    5 Bit        Muxes := 1     
	   2 Input    4 Bit        Muxes := 1     
	  10 Input    3 Bit        Muxes := 1     
	   2 Input    3 Bit        Muxes := 1     
	  10 Input    2 Bit        Muxes := 6     
	   2 Input    2 Bit        Muxes := 1     
	   2 Input    1 Bit        Muxes := 36    
	   6 Input    1 Bit        Muxes := 3     
	  10 Input    1 Bit        Muxes := 6     
	   4 Input    1 Bit        Muxes := 3     
	  11 Input    1 Bit        Muxes := 1     
	   8 Input    1 Bit        Muxes := 1     
---------------------------------------------------------------------------------
Finished RTL Component Statistics 
---------------------------------------------------------------------------------
---------------------------------------------------------------------------------
Start Part Resource Summary
---------------------------------------------------------------------------------
Part Resources:
DSPs: 240 (col length:80)
BRAMs: 270 (col length: RAMB18 80 RAMB36 40)
---------------------------------------------------------------------------------
Finished Part Resource Summary
---------------------------------------------------------------------------------
---------------------------------------------------------------------------------
Start Cross Boundary and Area Optimization
---------------------------------------------------------------------------------
WARNING: [Synth 8-7080] Parallel synthesis criteria is not met
WARNING: [Synth 8-6849] Infeasible attribute ram_style = "block" set for RAM "CSSTE/U11/vga_display/display_data_reg",trying to implement using LUTRAM
WARNING: [Synth 8-6849] Infeasible attribute ram_style = "block" set for RAM "CSSTE/U11/vga_display/display_data_reg",trying to implement using LUTRAM
WARNING: [Synth 8-3332] Sequential element (U1/ID/ImmGen_new_0/Imm_out_reg[31]) is unused and will be removed from module CSSTE.
WARNING: [Synth 8-3332] Sequential element (U1/ID/ImmGen_new_0/Imm_out_reg[30]) is unused and will be removed from module CSSTE.
WARNING: [Synth 8-3332] Sequential element (U1/ID/ImmGen_new_0/Imm_out_reg[29]) is unused and will be removed from module CSSTE.
WARNING: [Synth 8-3332] Sequential element (U1/ID/ImmGen_new_0/Imm_out_reg[28]) is unused and will be removed from module CSSTE.
WARNING: [Synth 8-3332] Sequential element (U1/ID/ImmGen_new_0/Imm_out_reg[27]) is unused and will be removed from module CSSTE.
WARNING: [Synth 8-3332] Sequential element (U1/ID/ImmGen_new_0/Imm_out_reg[26]) is unused and will be removed from module CSSTE.
WARNING: [Synth 8-3332] Sequential element (U1/ID/ImmGen_new_0/Imm_out_reg[25]) is unused and will be removed from module CSSTE.
WARNING: [Synth 8-3332] Sequential element (U1/ID/ImmGen_new_0/Imm_out_reg[24]) is unused and will be removed from module CSSTE.
WARNING: [Synth 8-3332] Sequential element (U1/ID/ImmGen_new_0/Imm_out_reg[23]) is unused and will be removed from module CSSTE.
WARNING: [Synth 8-3332] Sequential element (U1/ID/ImmGen_new_0/Imm_out_reg[22]) is unused and will be removed from module CSSTE.
WARNING: [Synth 8-3332] Sequential element (U1/ID/ImmGen_new_0/Imm_out_reg[21]) is unused and will be removed from module CSSTE.
WARNING: [Synth 8-3332] Sequential element (U1/ID/ImmGen_new_0/Imm_out_reg[20]) is unused and will be removed from module CSSTE.
WARNING: [Synth 8-3332] Sequential element (U1/ID/ImmGen_new_0/Imm_out_reg[19]) is unused and will be removed from module CSSTE.
WARNING: [Synth 8-3332] Sequential element (U1/ID/ImmGen_new_0/Imm_out_reg[18]) is unused and will be removed from module CSSTE.
WARNING: [Synth 8-3332] Sequential element (U1/ID/ImmGen_new_0/Imm_out_reg[17]) is unused and will be removed from module CSSTE.
WARNING: [Synth 8-3332] Sequential element (U1/ID/ImmGen_new_0/Imm_out_reg[16]) is unused and will be removed from module CSSTE.
WARNING: [Synth 8-3332] Sequential element (U1/ID/ImmGen_new_0/Imm_out_reg[15]) is unused and will be removed from module CSSTE.
WARNING: [Synth 8-3332] Sequential element (U1/ID/ImmGen_new_0/Imm_out_reg[14]) is unused and will be removed from module CSSTE.
WARNING: [Synth 8-3332] Sequential element (U1/ID/ImmGen_new_0/Imm_out_reg[13]) is unused and will be removed from module CSSTE.
WARNING: [Synth 8-3332] Sequential element (U1/ID/ImmGen_new_0/Imm_out_reg[12]) is unused and will be removed from module CSSTE.
WARNING: [Synth 8-3332] Sequential element (U1/ID/ImmGen_new_0/Imm_out_reg[11]) is unused and will be removed from module CSSTE.
WARNING: [Synth 8-3332] Sequential element (U1/ID/ImmGen_new_0/Imm_out_reg[10]) is unused and will be removed from module CSSTE.
WARNING: [Synth 8-3332] Sequential element (U1/ID/ImmGen_new_0/Imm_out_reg[9]) is unused and will be removed from module CSSTE.
WARNING: [Synth 8-3332] Sequential element (U1/ID/ImmGen_new_0/Imm_out_reg[8]) is unused and will be removed from module CSSTE.
WARNING: [Synth 8-3332] Sequential element (U1/ID/ImmGen_new_0/Imm_out_reg[7]) is unused and will be removed from module CSSTE.
WARNING: [Synth 8-3332] Sequential element (U1/ID/ImmGen_new_0/Imm_out_reg[6]) is unused and will be removed from module CSSTE.
WARNING: [Synth 8-3332] Sequential element (U1/ID/ImmGen_new_0/Imm_out_reg[5]) is unused and will be removed from module CSSTE.
WARNING: [Synth 8-3332] Sequential element (U1/ID/ImmGen_new_0/Imm_out_reg[4]) is unused and will be removed from module CSSTE.
WARNING: [Synth 8-3332] Sequential element (U1/ID/ImmGen_new_0/Imm_out_reg[3]) is unused and will be removed from module CSSTE.
WARNING: [Synth 8-3332] Sequential element (U1/ID/ImmGen_new_0/Imm_out_reg[2]) is unused and will be removed from module CSSTE.
WARNING: [Synth 8-3332] Sequential element (U1/ID/ImmGen_new_0/Imm_out_reg[1]) is unused and will be removed from module CSSTE.
WARNING: [Synth 8-3332] Sequential element (U1/ID/ImmGen_new_0/Imm_out_reg[0]) is unused and will be removed from module CSSTE.
---------------------------------------------------------------------------------
Finished Cross Boundary and Area Optimization : Time (s): cpu = 00:00:18 ; elapsed = 00:00:29 . Memory (MB): peak = 1344.078 ; gain = 758.145
---------------------------------------------------------------------------------
---------------------------------------------------------------------------------
Start ROM, RAM, DSP, Shift Register and Retiming Reporting
---------------------------------------------------------------------------------

ROM: Preliminary Mapping Report
+------------+------------+---------------+----------------+
|Module Name | RTL Object | Depth x Width | Implemented As | 
+------------+------------+---------------+----------------+
|VgaDisplay  | fonts_data | 4096x8        | LUT            | 
|CSSTE       | p_0_out    | 4096x8        | LUT            | 
+------------+------------+---------------+----------------+


Distributed RAM: Preliminary Mapping Report (see note below)
+------------+----------------------------------+-----------+----------------------+---------------+
|Module Name | RTL Object                       | Inference | Size (Depth x Width) | Primitives    | 
+------------+----------------------------------+-----------+----------------------+---------------+
|CSSTE       | U11/vga_display/display_data_reg | Implied   | 4 K x 8              | RAM64M x 192  | 
+------------+----------------------------------+-----------+----------------------+---------------+

Note: The table above is a preliminary report that shows the Distributed RAMs at the current stage of the synthesis flow. Some Distributed RAMs may be reimplemented as non Distributed RAM primitives later in the synthesis flow. Multiple instantiated RAMs are reported only once.
---------------------------------------------------------------------------------
Finished ROM, RAM, DSP, Shift Register and Retiming Reporting
---------------------------------------------------------------------------------
---------------------------------------------------------------------------------
Start Applying XDC Timing Constraints
---------------------------------------------------------------------------------
---------------------------------------------------------------------------------
Finished Applying XDC Timing Constraints : Time (s): cpu = 00:00:20 ; elapsed = 00:00:32 . Memory (MB): peak = 1378.691 ; gain = 792.758
---------------------------------------------------------------------------------
---------------------------------------------------------------------------------
Start Timing Optimization
---------------------------------------------------------------------------------
---------------------------------------------------------------------------------
Finished Timing Optimization : Time (s): cpu = 00:00:20 ; elapsed = 00:00:32 . Memory (MB): peak = 1383.016 ; gain = 797.082
---------------------------------------------------------------------------------
---------------------------------------------------------------------------------
Start ROM, RAM, DSP, Shift Register and Retiming Reporting
---------------------------------------------------------------------------------

Distributed RAM: Final Mapping Report
+------------+----------------------------------+-----------+----------------------+---------------+
|Module Name | RTL Object                       | Inference | Size (Depth x Width) | Primitives    | 
+------------+----------------------------------+-----------+----------------------+---------------+
|CSSTE       | U11/vga_display/display_data_reg | Implied   | 4 K x 8              | RAM64M x 192  | 
+------------+----------------------------------+-----------+----------------------+---------------+

---------------------------------------------------------------------------------
Finished ROM, RAM, DSP, Shift Register and Retiming Reporting
---------------------------------------------------------------------------------
---------------------------------------------------------------------------------
Start Technology Mapping
---------------------------------------------------------------------------------
---------------------------------------------------------------------------------
Finished Technology Mapping : Time (s): cpu = 00:00:20 ; elapsed = 00:00:33 . Memory (MB): peak = 1421.566 ; gain = 835.633
---------------------------------------------------------------------------------
---------------------------------------------------------------------------------
Start IO Insertion
---------------------------------------------------------------------------------
---------------------------------------------------------------------------------
Start Flattening Before IO Insertion
---------------------------------------------------------------------------------
---------------------------------------------------------------------------------
Finished Flattening Before IO Insertion
---------------------------------------------------------------------------------
---------------------------------------------------------------------------------
Start Final Netlist Cleanup
---------------------------------------------------------------------------------
---------------------------------------------------------------------------------
Finished Final Netlist Cleanup
---------------------------------------------------------------------------------
---------------------------------------------------------------------------------
Finished IO Insertion : Time (s): cpu = 00:00:22 ; elapsed = 00:00:35 . Memory (MB): peak = 1599.398 ; gain = 1013.465
---------------------------------------------------------------------------------
---------------------------------------------------------------------------------
Start Renaming Generated Instances
---------------------------------------------------------------------------------
---------------------------------------------------------------------------------
Finished Renaming Generated Instances : Time (s): cpu = 00:00:22 ; elapsed = 00:00:35 . Memory (MB): peak = 1599.398 ; gain = 1013.465
---------------------------------------------------------------------------------
---------------------------------------------------------------------------------
Start Rebuilding User Hierarchy
---------------------------------------------------------------------------------
---------------------------------------------------------------------------------
Finished Rebuilding User Hierarchy : Time (s): cpu = 00:00:22 ; elapsed = 00:00:35 . Memory (MB): peak = 1599.398 ; gain = 1013.465
---------------------------------------------------------------------------------
---------------------------------------------------------------------------------
Start Renaming Generated Ports
---------------------------------------------------------------------------------
---------------------------------------------------------------------------------
Finished Renaming Generated Ports : Time (s): cpu = 00:00:22 ; elapsed = 00:00:35 . Memory (MB): peak = 1599.398 ; gain = 1013.465
---------------------------------------------------------------------------------
---------------------------------------------------------------------------------
Start Handling Custom Attributes
---------------------------------------------------------------------------------
---------------------------------------------------------------------------------
Finished Handling Custom Attributes : Time (s): cpu = 00:00:22 ; elapsed = 00:00:35 . Memory (MB): peak = 1599.398 ; gain = 1013.465
---------------------------------------------------------------------------------
---------------------------------------------------------------------------------
Start Renaming Generated Nets
---------------------------------------------------------------------------------
---------------------------------------------------------------------------------
Finished Renaming Generated Nets : Time (s): cpu = 00:00:22 ; elapsed = 00:00:35 . Memory (MB): peak = 1599.398 ; gain = 1013.465
---------------------------------------------------------------------------------
---------------------------------------------------------------------------------
Start Writing Synthesis Report
---------------------------------------------------------------------------------

Report BlackBoxes: 
+------+--------------+----------+
|      |BlackBox name |Instances |
+------+--------------+----------+
|1     |ROM_D_0       |         1|
|2     |RAM           |         1|
|3     |Seg7_Dev_0    |         1|
|4     |SAnti_jitter  |         1|
|5     |clk_div       |         1|
|6     |Counter_x     |         1|
|7     |MIO_BUS       |         1|
|8     |Multi_8CH32   |         1|
|9     |SPIO          |         1|
|10    |Pipeline_Ex   |         1|
|11    |Ex_reg_Mem    |         1|
|12    |Pipeline_Mem  |         1|
|13    |Mem_reg_WB    |         1|
|14    |Pipeline_WB   |         1|
+------+--------------+----------+

Report Cell Usage: 
+------+------------------+------+
|      |Cell              |Count |
+------+------------------+------+
|1     |Counter_x_bbox    |     1|
|2     |Ex_reg_Mem_bbox   |     1|
|3     |MIO_BUS_bbox      |     1|
|4     |Mem_reg_WB_bbox   |     1|
|5     |Multi_8CH32_bbox  |     1|
|6     |Pipeline_Ex_bbox  |     1|
|7     |Pipeline_Mem_bbox |     1|
|8     |Pipeline_WB_bbox  |     1|
|9     |RAM               |     1|
|10    |ROM_D             |     1|
|11    |SAnti_jitter_bbox |     1|
|12    |SPIO_bbox         |     1|
|13    |Seg7_Dev          |     1|
|14    |clk_div_bbox      |     1|
|15    |BUFG              |     2|
|16    |CARRY4            |    19|
|17    |LUT1              |     4|
|18    |LUT2              |    92|
|19    |LUT3              |    45|
|20    |LUT4              |   164|
|21    |LUT5              |   316|
|22    |LUT6              |  1766|
|23    |MUXF7             |   577|
|24    |MUXF8             |    81|
|25    |RAM64M            |   128|
|26    |RAM64X1D          |    62|
|27    |FDCE              |  1022|
|28    |FDRE              |   247|
|29    |FDSE              |     2|
|30    |LD                |     2|
|31    |IBUF              |    22|
|32    |OBUF              |    46|
+------+------------------+------+
---------------------------------------------------------------------------------
Finished Writing Synthesis Report : Time (s): cpu = 00:00:22 ; elapsed = 00:00:35 . Memory (MB): peak = 1599.398 ; gain = 1013.465
---------------------------------------------------------------------------------
Synthesis finished with 0 errors, 0 critical warnings and 38 warnings.
Synthesis Optimization Runtime : Time (s): cpu = 00:00:19 ; elapsed = 00:00:34 . Memory (MB): peak = 1599.398 ; gain = 930.289
Synthesis Optimization Complete : Time (s): cpu = 00:00:22 ; elapsed = 00:00:35 . Memory (MB): peak = 1599.398 ; gain = 1013.465
INFO: [Project 1-571] Translating synthesized netlist
Parsing EDIF File [D:/XilinxData/ComputerOrganization/Experiment_05/Other_Referrence_IP/IP/SAnti_jitter.edf]
Finished Parsing EDIF File [D:/XilinxData/ComputerOrganization/Experiment_05/Other_Referrence_IP/IP/SAnti_jitter.edf]
Parsing EDIF File [D:/XilinxData/ComputerOrganization/Experiment_05/Other_Referrence_IP/IP/clk_div.edf]
Finished Parsing EDIF File [D:/XilinxData/ComputerOrganization/Experiment_05/Other_Referrence_IP/IP/clk_div.edf]
Parsing EDIF File [D:/XilinxData/ComputerOrganization/Experiment_05/Other_Referrence_IP/IP/Counter_x.edf]
Finished Parsing EDIF File [D:/XilinxData/ComputerOrganization/Experiment_05/Other_Referrence_IP/IP/Counter_x.edf]
Parsing EDIF File [D:/XilinxData/ComputerOrganization/Experiment_05/Other_Referrence_IP/IP/MIO_BUS.edf]
Finished Parsing EDIF File [D:/XilinxData/ComputerOrganization/Experiment_05/Other_Referrence_IP/IP/MIO_BUS.edf]
Parsing EDIF File [D:/XilinxData/ComputerOrganization/Experiment_05/Other_Referrence_IP/IP/Multi_8CH32.edf]
Finished Parsing EDIF File [D:/XilinxData/ComputerOrganization/Experiment_05/Other_Referrence_IP/IP/Multi_8CH32.edf]
Parsing EDIF File [D:/XilinxData/ComputerOrganization/Experiment_05/Other_Referrence_IP/IP/SPIO.edf]
Finished Parsing EDIF File [D:/XilinxData/ComputerOrganization/Experiment_05/Other_Referrence_IP/IP/SPIO.edf]
Parsing EDIF File [D:/XilinxData/ComputerOrganization/Experiment_05/Pipelined_CPU/Pipeline_Ex.edf]
Finished Parsing EDIF File [D:/XilinxData/ComputerOrganization/Experiment_05/Pipelined_CPU/Pipeline_Ex.edf]
Parsing EDIF File [D:/XilinxData/ComputerOrganization/Experiment_05/Pipelined_CPU/Ex_reg_Mem.edf]
Finished Parsing EDIF File [D:/XilinxData/ComputerOrganization/Experiment_05/Pipelined_CPU/Ex_reg_Mem.edf]
Parsing EDIF File [D:/XilinxData/ComputerOrganization/Experiment_05/Pipelined_CPU/Pipeline_Mem.edf]
Finished Parsing EDIF File [D:/XilinxData/ComputerOrganization/Experiment_05/Pipelined_CPU/Pipeline_Mem.edf]
Parsing EDIF File [D:/XilinxData/ComputerOrganization/Experiment_05/Pipelined_CPU/Mem_reg_WB.edf]
Finished Parsing EDIF File [D:/XilinxData/ComputerOrganization/Experiment_05/Pipelined_CPU/Mem_reg_WB.edf]
Parsing EDIF File [D:/XilinxData/ComputerOrganization/Experiment_05/Pipelined_CPU/Pipeline_WB.edf]
Finished Parsing EDIF File [D:/XilinxData/ComputerOrganization/Experiment_05/Pipelined_CPU/Pipeline_WB.edf]
Netlist sorting complete. Time (s): cpu = 00:00:00 ; elapsed = 00:00:00.051 . Memory (MB): peak = 1618.184 ; gain = 0.000
INFO: [Netlist 29-17] Analyzing 1004 Unisim elements for replacement
INFO: [Netlist 29-28] Unisim Transformation completed in 0 CPU seconds
INFO: [Project 1-479] Netlist was created with Vivado 2017.4
INFO: [Project 1-570] Preparing netlist for logic optimization
INFO: [Opt 31-138] Pushed 0 inverter(s) to 0 load pin(s).
Netlist sorting complete. Time (s): cpu = 00:00:00 ; elapsed = 00:00:00.001 . Memory (MB): peak = 1621.840 ; gain = 0.000
INFO: [Project 1-111] Unisim Transformation Summary:
  A total of 192 instances were transformed.
  LD => LDCE: 2 instances
  RAM64M => RAM64M (RAMD64E(x4)): 128 instances
  RAM64X1D => RAM64X1D (RAMD64E(x2)): 62 instances

Synth Design complete | Checksum: 18c51c77
INFO: [Common 17-83] Releasing license: Synthesis
82 Infos, 53 Warnings, 0 Critical Warnings and 0 Errors encountered.
synth_design completed successfully
synth_design: Time (s): cpu = 00:00:23 ; elapsed = 00:00:40 . Memory (MB): peak = 1621.840 ; gain = 1243.688
Write ShapeDB Complete: Time (s): cpu = 00:00:00 ; elapsed = 00:00:00.008 . Memory (MB): peak = 1621.840 ; gain = 0.000
INFO: [Common 17-1381] The checkpoint 'D:/XilinxData/ComputerOrganization/Experiment_05/Experiment05_Pipelined_CPU_MyIFID/Experiment05_Pipelined_CPU_MyIFID.runs/synth_1/CSSTE.dcp' has been generated.
INFO: [Vivado 12-24828] Executing command : report_utilization -file CSSTE_utilization_synth.rpt -pb CSSTE_utilization_synth.pb
INFO: [Common 17-206] Exiting Vivado at Fri Dec 12 10:38:24 2025...
